{
    "feedName": "claims_transaction",
    "feedDescription": "This is a feed for Claims Transaction Data Product",
    "workLoadType": "dp-spark",
    "skipProductLoad": false,
    "dataDeduplicationAlert": true,
    "deduplicationAlertTemplate": "deduplication_msg",
    "datasetsConfig": [
        {
            "datasetType": "database",
            "datasets": [   
                { "fileName": "accident", "sourceConfigFolderName": "iis_transaction" },
                { "fileName": "address", "sourceConfigFolderName": "iis_transaction" },
                { "fileName": "agency", "sourceConfigFolderName": "iis_transaction" },
                { "fileName": "aslob_codes", "sourceConfigFolderName": "iis_transaction" },
                { "fileName": "catcode", "sourceConfigFolderName": "iis_transaction" },
                { "fileName": "cl_coverage", "sourceConfigFolderName": "iis_transaction" },
                { "fileName": "cl_occurrence", "sourceConfigFolderName": "iis_transaction" },
                { "fileName": "claimant", "sourceConfigFolderName": "iis_transaction" },
                { "fileName": "claimant_status_asof", "sourceConfigFolderName": "iis_transaction" },
                { "fileName": "claims_accidentdescriptionnarrative", "sourceConfigFolderName": "iis_transaction" },
                { "fileName": "claims_adjustor_stats", "sourceConfigFolderName": "iis_transaction" },
                { "fileName": "claims_caextra", "sourceConfigFolderName": "iis_transaction" },
                { "fileName": "claims_catastrophe", "sourceConfigFolderName": "iis_transaction" },
                { "fileName": "claims_catcodes", "sourceConfigFolderName": "iis_transaction" },
                { "fileName": "claims_causedetail", "sourceConfigFolderName": "iis_transaction" },
                { "fileName": "claims_causeofloss", "sourceConfigFolderName": "iis_transaction" },
                { "fileName": "claims_cavehicles", "sourceConfigFolderName": "iis_transaction" },
                { "fileName": "claims_dbextra", "sourceConfigFolderName": "iis_transaction" },
                { "fileName": "claims_extra", "sourceConfigFolderName": "iis_transaction" },
                { "fileName": "claims_lossdetail", "sourceConfigFolderName": "iis_transaction" },
		        { "fileName": "dbo_claimstrans_ct", "sourceConfigFolderName": "iis_transaction" },
                { "fileName": "claimstrans_types", "sourceConfigFolderName": "iis_transaction" },
                { "fileName": "counties", "sourceConfigFolderName": "iis_transaction" },
                { "fileName": "employee", "sourceConfigFolderName": "iis_transaction" },
                { "fileName": "injury", "sourceConfigFolderName": "iis_transaction" },
                { "fileName": "insured", "sourceConfigFolderName": "iis_transaction" },
                { "fileName": "lob", "sourceConfigFolderName": "iis_transaction" },
                { "fileName": "lookups", "sourceConfigFolderName": "iis_transaction" },
                { "fileName": "payments", "sourceConfigFolderName": "iis_transaction" },
                { "fileName": "pc_coverage_ifields", "sourceConfigFolderName": "iis_transaction" },
                { "fileName": "pc_coverage_names", "sourceConfigFolderName": "iis_transaction" },
                { "fileName": "pc_coverage_reporting", "sourceConfigFolderName": "iis_transaction" },
                { "fileName": "provider", "sourceConfigFolderName": "iis_transaction" },
                { "fileName": "provtype", "sourceConfigFolderName": "iis_transaction" },
                { "fileName": "reserves", "sourceConfigFolderName": "iis_transaction" },
                { "fileName": "reservelimits", "sourceConfigFolderName": "iis_transaction" },
                { "fileName": "uwbuildings", "sourceConfigFolderName": "iis_transaction" },
                { "fileName": "uwvehicles", "sourceConfigFolderName": "iis_transaction" },
                { "fileName": "wcclaim", "sourceConfigFolderName": "iis_transaction" },
                { "fileName": "wcpmttyp", "sourceConfigFolderName": "iis_transaction" },
                { "fileName": "dbo_transaction_uwcoverage_ct", "sourceConfigFolderName": "iis_transaction" },
                { "fileName": "dbo_transaction_uwhomes_ct", "sourceConfigFolderName": "iis_transaction" },
                { "fileName": "dbo_wclocnam_ct", "sourceConfigFolderName": "iis_transaction" }
            ]
        }    
    ]
}